{
    "type": "tetra:default",
    "key": "tetra.stats.vexing",
    "contexts": [ "tetra:workbench" ],
    "min": 0,
    "max": 100,
    "stat": {
        "type": "tetra:multiply",
        "stats": [
            {
                "type": "tetra:effect_level",
                "effect": "vexing"
            }
        ],
        "factor": 10
    },
    "label": {
        "type": "tetra:basic",
        "format": "percentage",
        "diff_format": "percentage"
    },
    "tooltip": {
        "type": "tetra:default",
        "key": "tetra.stats.vexing.tooltip",
        "stats": [
            {
                "type": "tetra:effect_efficiency",
                "effect": "vexing"
            },
            {
                "type": "tetra:multiply",
                "stats": [
                    {
                        "type": "tetra:effect_level",
                        "effect": "vexing"
                    }
                ],
                "factor": 10
            }
        ],
        "formatters": [
            {
                "type": "tetra:basic",
                "format": "percentage"
            },
            {
                "type": "tetra:basic",
                "format": "percentage"
            }
        ]
    },
    "generateSorter": true
}
