{
    "type": "tetra:default",
    "key": "tetra.stats.heroic",
    "contexts": [
        "tetra:workbench"
    ],
    "min": 0,
    "max": 100,
    "stat": {
        "type": "tetra:effect_level",
        "effect": "heroic"
    },
    "label": {
        "type": "tetra:basic",
        "format": "percentage",
        "diff_format": "percentage"
    },
    "tooltip": {
        "type": "tetra:default",
        "key": "tetra.stats.heroic.tooltip",
        "stats": [
            {
                "type": "tetra:effect_level",
                "effect": "heroic"
            },
            {
                "type": "tetra:effect_efficiency",
                "effect": "heroic"
            }
        ]
    }
}
